{
  "change_type": "feature",
  "scope": ["src/**", "schemas/**", "tests/**"],
  "budgets": { "max_new_files": 15, "max_new_docs": 2, "max_net_added_lines": 1000 },
  "surface_debt": {
    "kind": "temporary_growth",
    "reason": "Introduce extraction seam before removing duplicated path",
    "expected_delta": { "max_new_files": 1, "max_net_added_lines": 60 },
    "repayment_issue": 123
  },
  "must_touch": ["package.json", "src/repo-guard.mjs"],
  "must_not_touch": ["LICENSE"],
  "expected_effects": ["CLI runner validates policy and contracts"]
}
